0011	DE-1a	Staatsbibliothek zu Berlin - Preußischer Kulturbesitz, Haus Potsdamer Straße
0020	DE-84	Universitätsbibliothek Braunschweig
0021	DE-46	Staats- und Universitätsbibliothek Bremen
0022	DE-18	Staats- und Universitätsbibliothek Hamburg Carl von Ossietzky
0022	DE-18-15	Hamburger Sternwarte am Fachbereich Physik der Universität Hamburg, Fachbibliothek Astronomie und Astrophysik
0022	DE-18-19	Universität Hamburg, Fachbereichsbibliothek Biologie, Standort Grindel
0022	DE-18-21	Universität Hamburg, Institut für Germanistik I, Bibliothek
0022	DE-18-24	Universität Hamburg, Bibliothek des Instituts für Geologie
0022	DE-18-39	Universität Hamburg, Institut für Anglistik und Amerikanistik, Bibliothek
0022	DE-18-47	Universität Hamburg, Physikalische Institute Jungiusstraße, Bibliothek
0022	DE-18-48	Fachbereich Chemie der Universität Hamburg, Bibliothek
0022	DE-18-57	Universität Hamburg, Institut für Geographie, Bibliothek
0022	DE-18-59	Universität Hamburg, Institut für Slavistik, Bibliothek
0022	DE-18-61	Universität Hamburg, Fachbereichsbibliothek SLM, Teilbibliothek Spanisch/Portugiesisch
0022	DE-18-64	Universitätsklinikum Hamburg-Eppendorf, Ärztliche Zentralbibliothek
0022	DE-18-76	Universität Hamburg, Fachbibliothek Sozialwissenschaften
0022	DE-18-114	Universität Hamburg, Musikwissenschaftliches Institut, Bibliothek
0022	DE-18-156	Universität Hamburg, Fachbereichsbibliothek SLM, Teilbibliothek NdL
0022	DE-18-161	Theologische Bibliothek der Universität Hamburg (Fachbereich Evangelische Theologie und Institut für Katholische Theologie)
0022	DE-18-219	Universität Hamburg, Institut für Finno-Ugristik / Uralistik, Bibliothek
0022	DE-18-226	Institut für Friedensforschung und Sicherheitspolitik an der Universität Hamburg, Bibliothek
0022	DE-18-228	Department Informatik der Universität Hamburg , Bibliothek
0022	DE-18-254	Stiftung Europa-Kolleg, Institut für Integrationsforschung, Bibliothek
0022	DE-18-261	Fakultät für Wirtschafts- und Sozialwissenschaften der Universität Hamburg, Fachbibliothek Wirtschaftswissenschaften
0022	DE-18-263	Universität Hamburg, Bibliothek - Mathematik und Geschichte der Naturwissenschaften
0022	DE-18-269	Universität Hamburg, Physikalische Institute Bahrenfeld, Bibliothek
0022	DE-18-270	Universität Hamburg, Physikalische Institute Bahrenfeld, Theoretische Physik, Bibliothek
0022	DE-18-278	Universität Hamburg, Institut für Allgemeine und Angewandte Sprachwissenschaft, Abteilung für Sprachlehrforschung, Bibliothek für Sprachlehrforschung
0022	DE-18-290	Universität Hamburg , Fachbereichsbibliothek Sprache Literatur Medien, Teilbibliothek Exilliteratur
0022	DE-18-294	Universität Hamburg, Fachbereichsbibliothek Sprache Literatur Medien, Teilbibliothek Allgemeine Sprachwissenschaft/Indogermanistik
0022	DE-18-295	Universität Hamburg, Institut für Deutsche Gebärdensprache und Kommunikation Gehörloser, Bibliothek
0022	DE-18-296	Universität Hamburg, Hamburger Bibliothek für Universitätsgeschichte
0022	DE-18-297	Zentrum für Molekulare Neurobiologie der Universität Hamburg, Bibliothek
0022	DE-18-303	Asien-Afrika-Institut der Universität Hamburg, Bibliothek
0022	DE-18-304	Universität Hamburg, Zentralbibliothek Recht
0022	DE-18-305	Universität Hamburg, Fachbereichsbibliothek Biologie, Standort Klein Flottbek
0022	DE-18-306	Bibliotheks- und Informationsservice (BIS) für Erdsystemforschung
0022	DE-18-307	Martha-Muchow-Bibliothek, Fachbibliothek für Erziehungswissenschaft, Psychologie und Bewegungswissenschaft der Universität Hamburg
0022	DE-18-308	Universität Hamburg, Fakultät Geisteswissenschaften, Fachbereichsbibliothek Kulturwissenschaften
0022	DE-18-309	Universität Hamburg, Zentralbibliothek Philosophie, Geschichte und Klassische Philologie
0022	DE-18-310	Universität Hamburg, Testbibliothek der Fakultät Erziehungswissenschaft, Psychologie und Bewegungswissenschaft
0022	DE-18-311	Konfuzius-Institut an der Universität Hamburg e.V., Bibliothek
0022	DE-18-312	Zentrale Stelle für Normdaten der Fachbibliotheken der Universität Hamburg
0022	DE-18-313	Nordost-Institut an der Universität Hamburg (IKGN e.V.), Bibliothek
0022	DE-18-314	
0023	DE-830	Technische Universität Hamburg, Universitätsbibliothek
0024	DE-8	Universitätsbibliothek Kiel, Zentralbibliothek
0024	DE-8-2	Universitätsbibliothek Kiel, Fachbibliothek Theologie
0024	DE-8-3	Universitätsbibliothek Kiel, Fachbibliothek am Juristischen Seminar
0024	DE-8-4	Universitätsbibliothek Kiel, Fachbibliothek am Walther-Schücking-Institut für Internationales Recht
0024	DE-8-6	Universitätsbibliothek Kiel, Fachbibliothek am Institut für Osteuropäisches Recht
0024	DE-8-7	Universitätsbibliothek Kiel, Fachbibliothek am Institut für Wirtschafts- und Steuerrecht
0024	DE-8-9	Universitätsbibliothek Kiel, Fachbibliothek für Wirtschaftswissenschaften
0024	DE-8-10	Universitätsbibliothek Kiel, Fachbibliothek Sozialwissenschaften
0024	DE-8-15	Universitätsbibliothek Kiel, Fachbibliothek an der Medizin- und Pharmaziehistorischen Sammlung Kiel
0024	DE-8-37	Universitätsbibliothek Kiel, Fachbibliothek am Philosophischen Seminar
0024	DE-8-38	Universitätsbibliothek Kiel, Fachbibliothek für Pädagogik
0024	DE-8-39	Universitätsbibliothek Kiel, Fachbibliothek am Institut für Psychologie
0024	DE-8-40	Universitätsbibliothek Kiel, Fachbibliothek Geschichte
0024	DE-8-44	Universitätsbibliothek Kiel, Fachbibliothek am Kunsthistorischen Institut
0024	DE-8-45	Universitätsbibliothek Kiel, Fachbibliothek an der Kunsthalle
0024	DE-8-46	Universitätsbibliothek Kiel, Fachbibliothek am Musikwissenschaftlichen Institut
0024	DE-8-47	Universitätsbibliothek Kiel, Fachbibliothek am Seminar für Europäische Ethnologie/Volkskunde
0024	DE-8-48	Universitätsbibliothek Kiel, Fachbibliothek am Institut für Skandinavistik, Frisistik und Allg. Sprachwissenschaft, Bereich Allg.Sprachwissenschaft
0024	DE-8-50	Universitätsbibliothek Kiel, Fachbibliothek am Institut für Klassische Altertumskunde
0024	DE-8-52	Universitätsbibliothek Kiel, Fachbibliothek Germanistik (Sprache / Literatur / Medien)
0024	DE-8-54	Universitätsbibliothek Kiel, Fachbibliothek am Institut für Skandinavistik, Frisistik und Allg. Sprachwissenschaft, Bereich Skandinavistik
0024	DE-8-55	Universitätsbibliothek Kiel, Fachbibliothek am Englischen Seminar
0024	DE-8-56	Universitätsbibliothek Kiel, Fachbibliothek am Romanischen Seminar
0024	DE-8-57	Universitätsbibliothek Kiel, Fachbibliothek am Institut für Slavistik
0024	DE-8-58	Universitätsbibliothek Kiel, Fachbibliothek am Institut für Sport und Sportwissenschaften
0024	DE-8-59	Universitätsbibliothek Kiel, Fachbibliothek am Institut für Ur- und Frühgeschichte
0024	DE-8-60	Universitätsbibliothek Kiel, Fachbibliothek Mathematik/Informatik/Rechenzentrum (Bereich Mathematik)
0024	DE-8-62	Universitätsbibliothek Kiel, Fachbibliothek Physikzentrum
0024	DE-8-64	Universitätsbibliothek Kiel, Fachbibliothek Chemie (Bereich Anorg. und Org. Chemie)
0024	DE-8-66	Universitätsbibliothek Kiel, Fachbibliothek am Pharmazeutischen Institut, Abteilung Pharmazeutische Chemie und PharmazeutischeTechnologie
0024	DE-8-67	Universitätsbibliothek Kiel, Fachbibliothek am Pharmazeutischen Institut, Abteilung Pharmazeutische Biologie
0024	DE-8-69	Universitätsbibliothek Kiel, Fachbibliothek am Institut für Geowissenschaften
0024	DE-8-70	Universitätsbibliothek Kiel, Fachbibliothek am Geographischen Institut
0024	DE-8-72	Universitätsbibliothek Kiel, Fachbibliothek am Institut für Pflanzenbau und –züchtung
0024	DE-8-73	Universitätsbibliothek Kiel, Fachbibliothek am Institut für Phytopathologie
0024	DE-8-74	Universitätsbibliothek Kiel, Fachbibliothek am Institut für Tierernährung, Stoffwechselphysiologie
0024	DE-8-75	Universitätsbibliothek Kiel, Fachbibliothek am Institut für Tierzucht und Tierhaltung
0024	DE-8-76	Universitätsbibliothek Kiel, Fachbibliothek am Institut für Landwirtschaftliche Verfahrenstechnik
0024	DE-8-79	Universitätsbibliothek Kiel, Fachbibliothek am Institut für Humanernährung und Lebensmittelkunde
0024	DE-8-81	Universitätsbibliothek Kiel, Fachbibliothek Ökologie und Wasserwirtschaft
0024	DE-452	Landesarchiv Schleswig-Holstein, Bibliothek
0024	DE-8-102	Universität Kiel, Bibliothek des Lorenz-von-Stein-Instituts für Verwaltungswissenschaften
0024	DE-8-51b	Universitätsbibliothek Kiel, Fachbibliothek am Seminar für Orientalistik
0024	DE-8-541	Universitätsbibliothek Kiel, Fachbibliothek am Institut für Skandinavistik, Frisistik und Allg. Sprachwissenschaft, Bereich Frisistik
0024	DE-8-601	Universitätsbibliothek Kiel, Fachbibliothek Mathematik/Informatik/Rechenzentrum (Bereich Informatik)
0024	DE-8-710	Universitätsbibliothek Kiel, Fachbibliothek am Institut für Internationales Privat- und Verfahrensrecht
0026	DE-206	ZBW - Leibniz-Informationszentrum Wirtschaft, Standort Kiel
0026	DE-206H	ZBW - Leibniz-Informationszentrum Wirtschaft, Standort Hamburg
0030	DE-104	Universitätsbibliothek Clausthal
0031	DE-27	Thüringer Universitäts- und Landesbibliothek
0032	DE-Ilm1	Universitätsbibliothek Ilmenau
0034	DE-1373	HafenCity Universität Hamburg, Bibliothek
0034	DE-18-302	Hochschule für Angewandte Wissenschaften Hamburg, Hochschulinformations- und Bibliotheksservice (HIBS), Fachbibliothek Technik, Wirtschaft, Informatik
0034	DE-18-284	Hochschule für Angewandte Wissenschaften Hamburg, Hochschulinformations- und Bibliotheksservice (HIBS), Fachbibliothek Life Sciences
0034	DE-18-285	Hochschule für Angewandte Wissenschaften Hamburg, Hochschulinformations- und Bibliotheksservice (HIBS), Fachbibliothek Design Medien Information
0034	DE-18-287	Hochschule für Angewandte Wissenschaften Hamburg, Hochschulinformations- und Bibliotheksservice , (HIBS), Fachbibliothek Soziale Arbeit und Pflege
0039	DE-547	Universitätsbibliothek Erfurt / Forschungsbibliothek Gotha, Universitätsbibliothek Erfurt
0039	DE-39	Forschungsbibliothek Gotha
0040	DE-7	Niedersächsische Staats- und Universitätsbibliothek Göttingen
0040	DE-7-001	früher: Göttingen; Institut für Organische und Biomolekulare Chemie, Bibliothek
0040	DE-7-003	Universität Göttingen, Mathematisches Institut, Bibliothek
0040	DE-7-006	Georg-Elias-Müller-Institut für Psychologie, Bibliothek
0040	DE-7-011	Zentrum Physiologie und Pathophysiologie, Zentrum Biochemie und Molekulare Zellbiologie, Bibliothek
0040	DE-7-037	Universität Göttingen, Zentralbibliotheken der Juristischen Fakultät
0040	DE-7-041	Institut für Völkerrecht und Europarecht, Bibliothek
0040	DE-7-042	Vereinigte Theologische Seminare, Bibliothek
0040	DE-7-050	Universität Göttingen, Pädagogisches Seminar, Bibliothek
0040	DE-7-118	Institut für Landwirtschaftsrecht, Bibliothek
0040	DE-7-155	Institut für Römisches Recht und Gemeines Recht, Bibliothek
0040	DE-7-160	Georg-August-Universität Göttingen, Bibliothek Waldweg
0040	DE-7-200	Institut für Arbeitsrecht, Bibliothek
0040	DE-7-201	Institut für Allgemeine Staatslehre und Politische Wissenschaften an der Juristischen Fakultät, Bibliothek
0040	DE-7-730	Zentrum Interdisziplinäre Einrichtungen, Abteilung Medizinische Informatik, Handbibliothek
0047	DE-Lin1b	Max-Planck-Institut für Sonnensystemforschung, Bibliothek
0048	DE-Goe134	Max-Planck-Institut für experimentelle Medizin, Karl-Thomas-Bibliothek
0049	DE-Goe164	Max-Planck-Institut zur Erforschung multireligiöser und multiethnischer Gesellschaften, Bibliothek
0050	DE-23	Herzog August Bibliothek Wolfenbüttel
0055	DE-Goe116	Otto-Hahn-Bibliothek des Max-Planck-Instituts für biophysikalische Chemie
0060	DE-705	Helmut-Schmidt-Universität, Universität der Bundeswehr Hamburg, Universitätsbibliothek
0061	DE-32	Klassik Stiftung Weimar / Herzogin Anna Amalia Bibliothek
0062	DE-28	Universitätsbibliothek Rostock
0062	DE-Wa1	Leibniz-Institut für Ostseeforschung Warnemünde, Bibliothek
0062	DE-Kue3	Leibniz-Institut für Atmosphärenphysik e.V. an der Universität Rostock, Bibliothek
0062	DE-R48	Forschungsinstitut für Nutztierbiologie, Bibliothek
0062	DE-563	Hochschule für Musik und Theater Rostock, Bibliothek
0062	DE-2161	Historische Bibliothek des Museums der Barlachstadt Güstrow
0063	DE-Wim2	UB Weimar
0065	DE-3	Universitäts- und Landesbibliothek Sachsen-Anhalt / Zentrale
0065	DE-3-1	Universitäts- und Landesbibliothek Sachsen-Anhalt, Zweigbibliothek Vorderer Orient / Ethnologie
0065	DE-3-4	Universitäts- und Landesbibliothek Sachsen-Anhalt, Zweigbibliothek Heide-Süd
0065	DE-3-6	Universitäts- und Landesbibliothek Sachsen-Anhalt, Zweigbibliothek Medizin-Campus
0065	DE-3-8	früher: Universitäts- und Landesbibliothek Sachsen-Anhalt, Zweigbibliothek Geobotanik
0065	DE-3-10	Universitäts- und Landesbibliothek Sachsen-Anhalt, Zweigbibliothek Franckeplatz
0065	DE-3-11	Universitäts- und Landesbibliothek Sachsen-Anhalt, Zweigbibliothek Rechtswissenschaft
0065	DE-3-18	Universitäts- und Landesbibliothek Sachsen-Anhalt, Zweigbibliothek Steintorcampus
0065	DE-3-19	Universitäts- und Landesbibliothek Sachsen-Anhalt, Zweigbibliothek Geowissenschaften
0065	DE-3-26	Universitäts- und Landesbibliothek Sachsen-Anhalt, Zweigbibliothek Klassische Altertumswissenschaften
0065	DE-3-27	Universitäts- und Landesbibliothek Sachsen-Anhalt, Zweigbibliothek Wirtschaftswissenschaften
0065	DE-3-38	Universitäts- und Landesbibliothek Sachsen-Anhalt, Zweigbibliothek Musik
0065	DE-3-150	Universitäts- und Landesbibliothek Sachsen-Anhalt, Zweigbibliothek Universitätsklinikum
0065	DE-3-179	Universitäts- und Landesbibliothek Sachsen-Anhalt, Zweigbibliothek Europäische Aufklärung /  Interdisziplinäres Zentrum für die Erforschung der Europäischen Aufklärung
0066	DE-Ha125	Burg Giebichenstein Kunsthochschule Halle, Hochschulbibliothek
0069	DE-9	Universitätsbibliothek Greifswald
0070	DE-89	Technische Informationsbibliothek (TIB) / Leibniz-Informationszentrum Technik und Naturwissenschaften und Universitätsbibliothek
0072	DE-35	Gottfried Wilhelm Leibniz Bibliothek - Niedersächsische Landesbibliothek
0073	DE-95	Stiftung Tierärztliche Hochschule Hannover, Bibliothek
0074	DE-354	Medizinische Hochschule Hannover, Bibliothek
0077	DE-Hv14	Niedersächsischer Landtag, Bibliothek
0078	DE-115	Stadtbibliothek Hannover
0090	DE-Hil2	Universitätsbibliothek Hildesheim
0091	DE-Hil3	HAWK Hochschule für angewandte Wissenschaft und Kunst Hildesheim/Holzminden/Göttingen, Bibliothek, Elektronische Ressourcen
0091	DE-Hil3-1	HAWK Hochschule für angewandte Wissenschaft und Kunst Hildesheim/Holzminden/Göttingen, Bibliothek Ingenieurwissenschaften und Gesundheit
0091	DE-Hil3-2	HAWK Hochschule für angewandte Wissenschaft und Kunst, Hildesheim/Holzminden/Göttingen, Bibliothek Ressourcenmanagement
0091	DE-Hil3-3	HAWK Hochschule für angewandte Wissenschaft und Kunst Hildesheim/ Holzminden/ Göttingen, Bibliothek Management, Soziale Arbeit, Bauen
0091	DE-Hil3-9	HAWK Hochschule für angewandte Wissenschaft und Kunst, Campus-Bibliothek
0092	DE-33	Landesbibliothek Mecklenburg-Vorpommern Günther Uecker im Landesamt für Kultur und Denkmalpflege
0095	DE-542	Hochschule Merseburg, Bibliothek
0095	DE-542	Hochschule Merseburg, Bibliothek
0096	DE-H358	Gerichtsbibliothek Lübeckertordamm 4
0096	DE-H123	Landessozialgericht und Sozialgericht Hamburg, Bibliothek
0096	DE-H359	Landesarbeitsgericht und Arbeitsgericht Hamburg, Bibliothek und Tarifvertragssammlung
0096	DE-H50	Hanseatisches Oberlandesgericht, Bibliothek
0096	DE-H42	Land- und Amtsgericht Hamburg, Bibliothek
0098	DE-Wim8	Hochschule für Musik Franz Liszt, Hochschulbibliothek
0100	DE-Ma9	Otto-von-Guericke-Universität, Universitätsbibliothek
0101	DE-Ma14	Otto-von-Guericke-Universität, Universitätsbibliothek, Medizinische Zentralbibliothek
0101	DE-Ma45	Leibniz-Institut für Neurobiologie, Wissenschaftliche Bibliothek
0104	DE-68	Schleswig-Holsteinische Landesbibliothek
0105	DE-572	Muthesius-Kunsthochschule, Zentrale Hochschulbibliothek
0110	DE-Luen4	Leuphana Universität Lüneburg, Medien- und Informationszentrum, Universitätsbibliothek
0111	DE-963	Hochschule 21, Bibliothek
0113	DE-2089	Staatsarchiv Hamburg
0114	DE-18-301	Akademie der Polizei Hamburg, Bibliothek
0118	DE-Kt1	Hochschule Anhalt , Hochschulbibliothek
0118	DE-De15	Stiftung Bauhaus Dessau, Bibliothek
0119	DE-Ef28	Thüringer Ministerium für Bildung, Wissenschaft und Kultur, Bibliothek
0119	DE-2500	Thüringer Landtag, Bibliothek
0119	DE-EF32	Thüringer Finanzministerium, Bibliothek
0119	DE-G11	Bildungszentrum der Thüringer Landesverwaltung in Gotha und Verwaltungsfachhochschule für die öffentliche Verwaltung, Bibliothek
0119	DE-Ef21	Landgericht Erfurt, Bibliothek
0119	DE-Ms8	Justizzentrum Mühlhausen, Bibliothek
0120	DE-715	Bibliotheks-und Informationssystem der Carl von Ossietzky Universität Oldenburg (BIS)
0121	DE-45	Landesbibliothek Oldenburg
0122	DE-897	Jade Hochschule Wilhelmshaven/Oldenburg/Elsfleth, Campus Oldenburg, Bibliothek
0123	DE-Ha33	Franckesche Stiftungen, Studienzentrum August Hermann Francke, Archiv und Bibliothek
0127	DE-18-258	Hochschule für Musik und Theater, Bibliothek
0129	DE-7-061	Department für Agrarökonomie und Rurale Entwicklung / Bibliothek für Agrarökonomie
0130	DE-700	Universitätsbibliothek Osnabrück
0131	DE-Va1	Universitätsbibliothek Vechta
0132	DE-959	Hochschule Osnabrück, Bibliothek Campus Westerberg
0132	DE-959-1	Hochschule Osnabrück, Bibliothek Campus Haste
0132	DE-959-3	Hochschule Osnabrück, Bibliothek Campus Lingen
0135	DE-Ha115	Landesamt für Denkmalpflege und Archäologie Sachsen-Anhalt, Bibliothek
0136	DE-Wis1	Hochschule Wismar, University of Applied Sciences: Technology, Business and Design, Hochschulbibliothek
0138	DE-564	Hochschule Nordhausen, Hochschulbibliothek
0139	DE-18-26	Hochschule für Bildende Künste, Bibliothek
0140	DE-839	Jade Hochschule Wilhelmshaven/Oldenburg/Elsfleth, Campus Wilhelmshaven, Bibliothek
0147	DE-Fl3	Zentrale Hochschulbibliothek Flensburg
0148	DE-Lue12	Musikhochschule Lübeck, Bibliothek
0150	DE-J59	Ernst-Abbe-Hochschule Jena, Wissenschaftliche Bibliothek
0151	DE-546	Fachhochschule Erfurt, Hochschulbibliothek
0152	DE-Shm2	Hochschule  Schmalkalden, Cellarius Bibliothek
0153	DE-Ha94	Max-Planck-Institut für Mikrostrukturphysik, Bibliothek
0154	DE-Bv2	Alfred-Wegener-Institut Helmholtz-Zentrum für Polar- und Meeresforschung, (AWI), Bibliothek
0156	DE-204	Ibero-Amerikanisches Institut Preußischer Kulturbesitz, Bibliothek
0160	DE-755	Hochschule Emden/Leer, Hochschulbibliothek
0161	DE-960	Bibliothek der Hochschule Hannover
0161	DE-960-1	Bibliothek der Hochschule Hannover, Zentralbibliothek
0161	DE-960-4	Bibliothek der Hochschule Hannover, Teilbibliothek Bioverfahrenstechnik
0161	DE-960-7	Bibliothek der Hochschule Hannover, Teilbibliothek Diakonie, Gesundheit und Soziales
0162	DE-Bv3	Deutsches Schifffahrtsmuseum, Bibliothek
0163	DE-996	Hochschule für Musik, Theater und Medien Hannover, Bibliothek
0164	DE-916	Ostfalia Hochschule für angewandte Wissenschaften, Bibliothek
0165	DE-834	Hochschule für Bildende Künste Braunschweig, Bibliothek
0168	DE-Bst1	Forschungszentrum Borstel / Leibniz-Lungenzentrum, Wissenschaftliche Informationsdienste & Bibliothek
0170	DE-Bs68	Physikalisch-Technische Bundesanstalt, Bibliothek
0170	DE-B108	Physikalisch-Technische Bundesanstalt, Institut Berlin, Bibliothek
0171	DE-Ha2	Deutsche Akademie der Naturforscher Leopoldina, Bibliothek
0172	DE-48	Bibliothek der Hansestadt Lübeck
0175	DE-M158a	ifo Institut für Wirtschaftsforschung an der Universität München, Bibliothek
0176	DE-Au3	Landschaftsbibliothek Aurich
0176	DE-Em2	Johannes a Lasco Bibliothek Große Kirche Emden
0179	DE-B4	Berlin-Brandenburgische Akademie der Wissenschaften, Akademiebibliothek
0181	DE-B11	Staatliche Museen zu Berlin, Preußischer Kulturbesitz, Kunstbibliothek
0181	DE-B11d	Staatliche Museen zu Berlin, Preußischer Kulturbesitz, Kunstbibliothek, Archäologische Bibliothek
0181	DE-B11b	Staatliche Museen zu Berlin, Preußischer Kulturbesitz, Ethnologisches Museum, Bibliothek
0181	DE-B11c	Staatliche Museen zu Berlin, Preußischer Kulturbesitz, Museum Europäischer Kulturen, Bibliothek
0181	DE-B11e	Staatliche Museen zu Berlin, Preußischer Kulturbesitz, Institut für Museumsforschung, Bibliothek
0181	DE-3181-61	
0181	DE-3181-80	
0181	DE-3181-90	
0181	DE-B32a4	
0181	DE-3181-150	
0181	DE-3181-180	
0181	DE-3181-190	
0181	DE-3181-191	
0181	DE-3181-200	
0182	DE-H77	Stiftung Historische Museen Hamburg, Museum für Hamburgische Geschichte, Bibliothek
0183	DE-H144	Behörde für Stadtentwicklung und Wohnen / Behörde für Umwelt und Energie - Bibliothek Stadtentwicklung, Umwelt und Geologie: Sondersammlung des Geologischen Landesamtes (GLA)
0183	DE-H216	Zentrale Bibliothek Behörden Hamburger Straße
0183	DE-H23	Freie und Hansestadt Hamburg, Behörde für Gesundheit und Verbraucherschutz, Bibliothek Gesundheit
0183	DE-H184	Behörde für Stadtentwicklung und Wohnen / Behörde für Umwelt und Energie - Bibliothek Stadtentwicklung, Umwelt und Geologie
0183	DE-H367	Justizbehörde Hamburg, Bibliothek
0183	DE-H38	Hamburg Port Authority, Bibliothek
0183	DE-H364	Behörde für Stadtentwicklung und Wohnen / Behörde für Umwelt und Energie - Bibliothek Stadtentwicklung, Umwelt und Geologie
0183	DE-H27	Freie und Hansestadt Hamburg, Behörde für Gesundheit und Verbraucherschutz, Institut für Hygiene und Umwelt, Bibliothek
0184	DE-H360	Bucerius Law School, Hochschule für Rechtswissenschaft, "Hengeler Mueller"-Bibliothek
0185	DE-Sra5	Hochschule Stralsund, Hochschulbibliothek
0186	DE-519	Hochschule Neubrandenburg, Bibliothek
0187	DE-Ki95	Fachhochschule Kiel, Zentralbibliothek
0187	DE-Ki95-2	Fachhochschule Kiel, Fachbereich Agrarwirtschaft, Bibliothek
0187	DE-Ki95	Fachhochschule Kiel, Zentralbibliothek
0188	DE-J121	Thüringer Landesanstalt für Umwelt und Geologie, Bibliothek
0188	DE-153	Stadtbibliothek Osnabrück
0192	DE-111	Anhaltische Landesbücherei Dessau (Wissenschaftliche Bibliothek)
0195	DE-Ha93	Leibniz-Institut für Pflanzenbiochemie, Bibliothek
0201	DE-Ki131	Wehrtechnische Dienststelle für Schiffe und Marinewaffen, Maritime Technologie und Forschung, Bibliothek
0202	DE-Sra6	Deutsches Meeresmuseum, Bibliothek
0203	DE-H189	Denkmalschutzamt der Freien und Hansestadt Hamburg, Bibliothek
0203	DE-H210	Archäologisches Museum Hamburg -  Stadtmuseum Harburg, Bibliothek
0203	DE-H189	Denkmalschutzamt der Freien und Hansestadt Hamburg, Bibliothek
0203	DE-H353	Stiftung Historische Museen Hamburg, Museum der Arbeit, Bibliothek
0203	DE-H13	Hamburger Kunsthalle, Bibliothek
0203	DE-H103	Stiftung Historische Museen Hamburg, Altonaer Museum, Museum für Kunst- und Kulturgeschichte, Bibliothek
0203	DE-H77	Stiftung Historische Museen Hamburg, Museum für Hamburgische Geschichte, Bibliothek
0203	DE-H22	Gerd Bucerius Bibliothek im Museum für Kunst und Gewerbe
0203	DE-H16	Museum am Rothenbaum, Bibliothek
0203	DE-H366	KZ-Gedenkstätte Neuengamme, Bibliothek
0206	DE-Brg3	Hochschulbibliothek Friedensau
0207	DE-1041	Fachhochschule Westküste, Hochschule für Wirtschaft und Technik, Hochschulbibliothek
0209	DE-Pn1	Max-Planck-Institut für Evolutionsbiologie, Bibliothek
0211	DE-Gat1	Leibniz-Institut für Pflanzengenetik und Kulturpflanzenforschung (IPK), Wissenschaftliche Bibliothek / Dokumentation
0213	DE-551	Hochschule Magdeburg-Stendal, Hochschulbibliothek
0215	DE-Ma54	Max-Planck-Institut für Dynamik Komplexer Technischer Systeme, Bibliothek
0216	DE-Bs78	Leibniz-Institut für Bildungsmedien | Georg-Eckert-Institut
0217	DE-Hv119	Michaeliskloster, Evangelisches Zentrum für Gottesdienst und Kirchenmusik, Bibliothek
0217	DE-Hv111	Evangelisch-Lutherisches Landeskirchenamt, Bibliothek
0217	DE-Lo1	Klosterbibliothek Loccum
0224	DE-2575	Leibniz-Institut für Agrarentwicklung in Transformationsökonomien, Bibliothek
0225	DE-Wim21	Materialforschungs- und -prüfanstalt an der Bauhaus-Universität Weimar (MFPA), Bibliothek
0227	DE-56	Stadtbibliothek Braunschweig
0230	DE-552	Hochschule Magdeburg-Stendal, Standort Stendal, Bibliothek
0231	DE-527	Hochschule Harz, Hauptbibliothek, Standort Wernigerode / Harz
0231	DE-527-2	Hochschule Harz, Bibliothek, Standort Halberstadt
0234	DE-572	Muthesius-Kunsthochschule, Zentrale Hochschulbibliothek
0235	DE-Hv128	Niedersächsisches Ministerium für Soziales, Gesundheit und Gleichstellung, Bibliothek
0235	DE-Hv131	Niedersächsisches Ministerium für Ernährung, Landwirtschaft und Verbraucherschutz, Informations- und Bibliotheksdienste
0235	DE-Hv133	Bibliothek des Niedersächsischen Justizministeriums
0235	DE-Hv110	Niedersächsische Staatskanzlei, Bibliothek
0235	DE-HV118	Sozialgericht Hannover, Bibliothek
0235	DE-2506	Behördenbibliothek der Deutschen Rentenversicherung Braunschweig-Hannover
0235	DE-Luen3	Niedersächsisches Oberverwaltungsgericht, Bibliothek
0235	DE-Hil4	Niedersächsischer Landesbetrieb für Wasserwirtschaft, Küsten- und Naturschutz, Bibliothek
0235	DE-Hil5	Niedersächsischer Landesrechnungshof, Bibliothek und Informationsdienste
0235	DE-Ce2	Bibliothek des Oberlandesgerichtes in Celle und Bibliothek der Grupen'schen Stiftung
0235	DE-940	Oberlandesgericht Oldenburg, Bibliothek
0235	DE-Nb2	Polizeiakademie Niedersachsen, Bibliothek
0235	DE-58	Fürstlich Schaumburg-Lippische Hofbibliothek
0235	DE-Hv126	Niedersächsisches Ministerium für Inneres und Sport, Bibliothek
0235	DE-2299	Niedersächsisches Landesamt für Denkmalpflege
0237	DE-Wb12	Stiftung Leucorea Wittenberg, Bibliothek
0240	DE-138	Eutiner Landesbibliothek
0241	DE-B763	Staatliches Institut für Musikforschung - Preußischer Kulturbesitz, Bibliothek
0244	DE-B41	Geheimes Staatsarchiv Preußischer Kulturbesitz, Bibliothek
0245	DE-Me7	Thüringer Verwaltungsfachhochschule, Fachbereich Polizei / Bildungszentrum der Thüringer Polizei, Bibliothek
0250	DE-Ga20	Duale Hochschule Gera-Eisenach, Bibliothek, Campus Gera
0252	DE-Bs66	Julius Kühn-Institut, Bundesforschungsinstitut für Kulturpflanzen, Informationszentrum und Bibliothek Braunschweig
0252	DE-B85	Julius Kühn-Institut, Bundesforschungsinstitut für Kulturpflanzen, Informationszentrum und Bibliothek Berlin-Dahlem
